### ISSUE TITLE
SETUP:400 Bad Request 错误

### ISSUE THREAD

**Issue by yuezhongxin** [xia-chu/ZLMediaKit#814]
你好，大神，我用rtsp转hls的时候报错，日志如下：

```
2021-04-08 10:13:50.112 T MediaServer_Online[3305] HttpSession.cpp:30 HttpSession | 140432881250224(39.144.12.225:38548)
2021-04-08 10:13:50.153 T MediaServer_Online[3305] HttpSession.cpp:30 HttpSession | 140433082596528(47.99.111.202:40774)
2021-04-08 10:13:50.153 D MediaServer_Online[3305] RtspPlayer.cpp:83 play | rtsp://127.0.0.1:11100/0/av1 null null 0
2021-04-08 10:13:50.202 W MediaServer_Online[3305] RtspPlayer.cpp:742 onPlayResult_l | 255 SETUP:400 Bad Request
2021-04-08 10:13:50.202 D MediaServer_Online[3305] WebApi.cpp:186 operator() |
# request:
GET /index/api/addStreamProxy?secret=035c73f7-bb6b-4889-a715-d9eb2d1925cc&vhost=__defaultVhost__&app=prepare&stream=670&url=rtsp://127.0.0.1:11100/0/av1&enable_rtsp=0&enable_rtsp=0&enable_rtmp=0&enable_hls=1&rtp_type=0
# content:

# args:
app : prepare
enable_hls : 1
enable_rtmp : 0
enable_rtsp : 0
rtp_type : 0
secret : 035c73f7-bb6b-4889-a715-d9eb2d1925cc
stream : 670
url : rtsp://127.0.0.1:11100/0/av1
vhost : __defaultVhost__
# response:
{
   "code" : -1,
   "msg" : "SETUP:400 Bad Request"
}
```

然后rtsp用ffplay播放正常，日志如下：

```
./ffplay -rtsp_transport tcp "rtsp://xxxx.xxxx.com:11100/0/av1"
ffplay version 4.3.1-tessus  https://evermeet.cx/ffmpeg/  Copyright (c) 2003-2020 the FFmpeg developers
  built with Apple clang version 11.0.0 (clang-1100.0.33.17)
  configuration: --cc=/usr/bin/clang --prefix=/opt/ffmpeg --extra-version=tessus --enable-avisynth --enable-fontconfig --enable-gpl --enable-libaom --enable-libass --enable-libbluray --enable-libdav1d --enable-libfreetype --enable-libgsm --enable-libmodplug --enable-libmp3lame --enable-libmysofa --enable-libopencore-amrnb --enable-libopencore-amrwb --enable-libopenh264 --enable-libopenjpeg --enable-libopus --enable-librubberband --enable-libshine --enable-libsnappy --enable-libsoxr --enable-libspeex --enable-libtheora --enable-libtwolame --enable-libvidstab --enable-libvmaf --enable-libvo-amrwbenc --enable-libvorbis --enable-libvpx --enable-libwavpack --enable-libwebp --enable-libx264 --enable-libx265 --enable-libxavs --enable-libxvid --enable-libzimg --enable-libzmq --enable-libzvbi --enable-version3 --pkg-config-flags=--static --enable-librtmp --enable-ffplay --enable-sdl2 --disable-ffmpeg --disable-ffprobe
  libavutil      56. 51.100 / 56. 51.100
  libavcodec     58. 91.100 / 58. 91.100
  libavformat    58. 45.100 / 58. 45.100
  libavdevice    58. 10.100 / 58. 10.100
  libavfilter     7. 85.100 /  7. 85.100
  libswscale      5.  7.100 /  5.  7.100
  libswresample   3.  7.100 /  3.  7.100
  libpostproc    55.  7.100 / 55.  7.100
[rtsp @ 0x7ffea007ee00] getaddrinfo(xxxx.xxxx.com): nodename nor servname provided, or not known
Input #0, rtsp, from 'rtsp://xxxx.xxxx.com:11100/0/av1':
  Metadata:
    title           : h264.mp4
    comment         : TAS-Tech Live Cast
  Duration: N/A, start: 0.000000, bitrate: N/A
    Stream #0:0: Video: h264 (Main), yuv420p(progressive), 640x352, 11.92 fps, 25 tbr, 90k tbn, 23.75 tbc
    Stream #0:1: Audio: pcm_alaw, 8000 Hz, 1 channels, s16, 64 kb/s
```

是啥原因啊？麻烦大神看看

**Comment by yuezhongxin** [comment]
wireshark抓包：
```
OPTIONS rtsp://192.168.1.172:554/0/av0 RTSP/1.0
CSeq: 2
User-Agent: LibVLC/3.0.9.2 (LIVE555 Streaming Media v2016.11.28)

RTSP/1.0 200 OK
CSeq: 2
Server: TAS-Tech Streaming Server V100R001
Public: DESCRIBE, SET_PARAMETER, SETUP, TEARDOWN, PAUSE, PLAY

DESCRIBE rtsp://192.168.1.172:554/0/av0 RTSP/1.0
CSeq: 3
User-Agent: LibVLC/3.0.9.2 (LIVE555 Streaming Media v2016.11.28)
Accept: application/sdp

RTSP/1.0 200 OK
CSeq: 3
Server: TAS-Tech Streaming Server V100R001
Content-Type: application/sdp
Content-length: 414

v=0
o=StreamingServer 3331435948 1116907222000 IN IP4 192.168.1.172
s=h264.mp4
i=TAS-Tech Live Cast
c=IN IP4 192.168.1.172
t=0 0
a=recvonly
a=range:npt=now-
m=video 0 RTP/AVP 96
a=control:rtsp://192.168.1.172:554/0/video0
a=rtpmap:96 H264/90000
a=fmtp:96 packetization-mode=1
a=framesize:96 1280-720
m=audio 0 RTP/AVP 8
a=control:rtsp://192.168.1.172:554/0/audio
a=rtpmap:8 pcma/8000
a=ptime:40

SETUP rtsp://192.168.1.172:554/0/video0 RTSP/1.0
CSeq: 4
User-Agent: LibVLC/3.0.9.2 (LIVE555 Streaming Media v2016.11.28)
Transport: RTP/AVP;unicast;client_port=55648-55649

RTSP/1.0 200 OK
CSeq: 4
Server: TAS-Tech Streaming Server V100R001
Session: 16zNk9vE00a8; timeout=60
Transport: RTP/AVP;unicast;client_port=55648-55649;server_port=8001-8002

SETUP rtsp://192.168.1.172:554/0/audio RTSP/1.0
CSeq: 5
User-Agent: LibVLC/3.0.9.2 (LIVE555 Streaming Media v2016.11.28)
Transport: RTP/AVP;unicast;client_port=61716-61717
Session: 16zNk9vE00a8

RTSP/1.0 200 OK
CSeq: 5
Server: TAS-Tech Streaming Server V100R001
Session: 16zNk9vE00a8; timeout=60
Transport: RTP/AVP;unicast;client_port=61716-61717;server_port=8001-8002

PLAY rtsp://192.168.1.172:554/0/av0 RTSP/1.0
CSeq: 6
User-Agent: LibVLC/3.0.9.2 (LIVE555 Streaming Media v2016.11.28)
Session: 16zNk9vE00a8
Range: npt=0.000-

RTSP/1.0 200 OK
CSeq: 6
Server: TAS-Tech Streaming Server V100R001
Range: npt=now-

TEARDOWN rtsp://192.168.1.172:554/0/av0 RTSP/1.0
CSeq: 7
User-Agent: LibVLC/3.0.9.2 (LIVE555 Streaming Media v2016.11.28)
Session: 16zNk9vE00a8

RTSP/1.0 200 OK
CSeq: 7
Server: TAS-Tech Streaming Server V100R001
```

**Comment by xia-chu** [comment]
你抓包zlm的rtsp请求

**Comment by yuezhongxin** [comment]
zlm部署在服务器，不太好抓。。。

**Comment by xia-chu** [comment]
tcpdump学习下

**Comment by yuezhongxin** [comment]
好的，我试试

**Comment by yuezhongxin** [comment]
大神，是这个吗？我用的`tcpdump port 49997`命令，日志：

```
11:29:55.546675 IP 115.236.86.6.61154 > xxxxx.xxxxx.xxxx.49997: Flags [S], seq 3037940753, win 65535, options [mss 1460,nop,wscale 6,nop,nop,TS val 1005402042 ecr 0,sackOK,eol], length 0
11:29:55.546708 IP xxxxx.xxxxx.xxxx.49997 > 115.236.86.6.61154: Flags [S.], seq 3607144750, ack 3037940754, win 28960, options [mss 1460,sackOK,TS val 603791367 ecr 1005402042,nop,wscale 7], length 0
11:29:55.559654 IP 115.236.86.6.61154 > xxxxx.xxxxx.xxxx.49997: Flags [.], ack 1, win 2058, options [nop,nop,TS val 1005402065 ecr 603791367], length 0
11:29:55.560156 IP 115.236.86.6.61154 > xxxxx.xxxxx.xxxx.49997: Flags [P.], seq 1:603, ack 1, win 2058, options [nop,nop,TS val 1005402065 ecr 603791367], length 602
11:29:55.560174 IP xxxxx.xxxxx.xxxx.49997 > 115.236.86.6.61154: Flags [.], ack 603, win 236, options [nop,nop,TS val 603791380 ecr 1005402065], length 0
11:29:55.603560 IP xxxxx.xxxxx.xxxx.49997 > 115.236.86.6.61154: Flags [P.], seq 1:236, ack 603, win 236, options [nop,nop,TS val 603791424 ecr 1005402065], length 235
11:29:55.603828 IP xxxxx.xxxxx.xxxx.49997 > 115.236.86.6.61154: Flags [P.], seq 236:291, ack 603, win 236, options [nop,nop,TS val 603791424 ecr 1005402065], length 55
11:29:55.614644 IP 115.236.86.6.61154 > xxxxx.xxxxx.xxxx.49997: Flags [.], ack 236, win 2055, options [nop,nop,TS val 1005402117 ecr 603791424], length 0
11:29:55.615650 IP 115.236.86.6.61154 > xxxxx.xxxxx.xxxx.49997: Flags [.], ack 291, win 2054, options [nop,nop,TS val 1005402117 ecr 603791424], length 0
11:29:55.615665 IP 115.236.86.6.61154 > xxxxx.xxxxx.xxxx.49997: Flags [F.], seq 603, ack 291, win 2054, options [nop,nop,TS val 1005402117 ecr 603791424], length 0
11:29:55.615773 IP xxxxx.xxxxx.xxxx.49997 > 115.236.86.6.61154: Flags [F.], seq 291, ack 604, win 236, options [nop,nop,TS val 603791436 ecr 1005402117], length 0
11:29:55.639652 IP 115.236.86.6.61154 > xxxxx.xxxxx.xxxx.49997: Flags [.], ack 292, win 2054, options [nop,nop,TS val 1005402139 ecr 603791436], length 0
```

**Comment by yuezhongxin** [comment]
大神，是这个吗？我用的`tcpdump port 11100 -i lo`命令，日志：

```
11:45:54.264310 IP localhost.36198 > localhost.11100: Flags [S], seq 2055049962, win 65535, options [mss 65495,sackOK,TS val 604750084 ecr 0,nop,wscale 2], length 0
11:45:54.264326 IP localhost.11100 > localhost.36198: Flags [S.], seq 302873332, ack 2055049963, win 43690, options [mss 65495,sackOK,TS val 604750084 ecr 604750084,nop,wscale 7], length 0
11:45:54.264338 IP localhost.36198 > localhost.11100: Flags [.], ack 1, win 32748, options [nop,nop,TS val 604750084 ecr 604750084], length 0
11:45:54.264910 IP localhost.36198 > localhost.11100: Flags [P.], seq 1:118, ack 1, win 32748, options [nop,nop,TS val 604750085 ecr 604750084], length 117
11:45:54.264925 IP localhost.11100 > localhost.36198: Flags [.], ack 118, win 342, options [nop,nop,TS val 604750085 ecr 604750085], length 0
11:45:54.295860 IP localhost.11100 > localhost.36198: Flags [P.], seq 1:136, ack 118, win 342, options [nop,nop,TS val 604750116 ecr 604750085], length 135
11:45:54.295868 IP localhost.36198 > localhost.11100: Flags [.], ack 136, win 33016, options [nop,nop,TS val 604750116 ecr 604750116], length 0
11:45:54.296051 IP localhost.36198 > localhost.11100: Flags [P.], seq 118:261, ack 136, win 33016, options [nop,nop,TS val 604750116 ecr 604750116], length 143
11:45:54.312324 IP localhost.11100 > localhost.36198: Flags [P.], seq 136:662, ack 261, win 350, options [nop,nop,TS val 604750132 ecr 604750116], length 526
11:45:54.312763 IP localhost.36198 > localhost.11100: Flags [P.], seq 261:431, ack 662, win 33284, options [nop,nop,TS val 604750133 ecr 604750132], length 170
11:45:54.324769 IP localhost.11100 > localhost.36198: Flags [P.], seq 662:743, ack 431, win 359, options [nop,nop,TS val 604750145 ecr 604750133], length 81
11:45:54.325178 IP localhost.36198 > localhost.11100: Flags [P.], seq 431:549, ack 743, win 33284, options [nop,nop,TS val 604750145 ecr 604750145], length 118
11:45:54.325310 IP localhost.36198 > localhost.11100: Flags [F.], seq 549, ack 743, win 33284, options [nop,nop,TS val 604750145 ecr 604750145], length 0
11:45:54.325356 IP localhost.11100 > localhost.36198: Flags [F.], seq 743, ack 550, win 359, options [nop,nop,TS val 604750145 ecr 604750145], length 0
11:45:54.325380 IP localhost.36198 > localhost.11100: Flags [.], ack 744, win 33284, options [nop,nop,TS val 604750146 ecr 604750145], length 0
```

**Comment by xia-chu** [comment]
你学习下tcpdump导出wireshark的抓包格式文件

**Comment by yuezhongxin** [comment]
好的，我试试

**Comment by yuezhongxin** [comment]
好了大神，日志：

```
OPTIONS rtsp://127.0.0.1:11100/0/av1 RTSP/1.0
CSeq: 1
User-Agent: ZLMediaKit-5.0(build in Sep 14 2020 15:59:38)

RTSP/1.0 200 OK
CSeq: 1
Server: TAS-Tech Streaming Server V100R001
Public: DESCRIBE, SET_PARAMETER, SETUP, TEARDOWN, PAUSE, PLAY

DESCRIBE rtsp://127.0.0.1:11100/0/av1 RTSP/1.0
Accept: application/sdp
CSeq: 2
User-Agent: ZLMediaKit-5.0(build in Sep 14 2020 15:59:38)

RTSP/1.0 200 OK
CSeq: 2
Server: TAS-Tech Streaming Server V100R001
Content-Type: application/sdp
Content-length: 402

v=0
o=StreamingServer 3331435948 1116907222000 IN IP4 127.0.0.1
s=h264.mp4
i=TAS-Tech Live Cast
c=IN IP4 127.0.0.1
t=0 0
a=recvonly
a=range:npt=now-
m=video 0 RTP/AVP 96
a=control:rtsp://127.0.0.1:11100/0/video1
a=rtpmap:96 H264/90000
a=fmtp:96 packetization-mode=1
a=framesize:96 1280-720
m=audio 0 RTP/AVP 8
a=control:rtsp://127.0.0.1:11100/0/audio
a=rtpmap:8 pcma/8000
a=ptime:40

SETUP rtsp://127.0.0.1:11100/0/av1/video1 RTSP/1.0
CSeq: 3
Transport: RTP/AVP/TCP;unicast;interleaved=0-1
User-Agent: ZLMediaKit-5.0(build in Sep 14 2020 15:59:38)

RTSP/1.0 400 Bad Request
CSeq: 3
Server: TAS-Tech Streaming Server V100R001

TEARDOWN rtsp://127.0.0.1:11100/0/av1 RTSP/1.0
CSeq: 4
User-Agent: ZLMediaKit-5.0(build in Sep 14 2020 15:59:38)


```

**Comment by xia-chu** [comment]
你更新下zlm就行了

**Comment by yuezhongxin** [comment]
好的，感谢大神，我试试

**Comment by yuezhongxin** [comment]
可以了，感谢大神~

**Comment by yuezhongxin** [comment]
@xia-chu 另外，问下大神，音频播放不了，是啥原因，ffplay日志：

![image](https://user-images.githubusercontent.com/6800671/113995489-e206c200-9888-11eb-96ab-a0460fa08d8e.png)

zlm日志：

```
2021-04-08 16:34:12.839 I MediaServer_Online[8656-140465325991680] MultiMediaSourceMuxer.cpp:286 onAllTrackReady | stream: __defaultVhost__ online 672 , codec info: CodecG711A[8000/1/16] CodecH264[640/352/12]
2021-04-08 16:34:12.839 I MediaServer_Online[8656-140465325991680] MediaSource.cpp:402 emitEvent | 媒体注册:rtmp __defaultVhost__ online 672
2021-04-08 16:34:12.839 I MediaServer_Online[8656-140465325991680] MediaSource.cpp:402 emitEvent | 媒体注册:ts __defaultVhost__ online 672
```

**Comment by xia-chu** [comment]
FFmpeg解码没出错说明音频时ok的 说明可能是静音音频

**Comment by yuezhongxin** [comment]
我用耳机听了下，ffplay播放是有声音的，但zlm转成hls播放就没声音了。

**Comment by xia-chu** [comment]
哦 那可能播放器不支持hls吧

**Comment by xia-chu** [comment]
你可以试试http-ts

**Comment by yuezhongxin** [comment]
哦哦，好的，我再试试看
